[
  {"chart_number":1,"blind_chart_id":"B-002fdab9ac7c6a8b96ea","outcome_bucket":"LOSS_0_TO_10PCT","post_path_label":"LATE_REJECTION","evidence":"前5日尚未持续走弱，+5后至H20形成明确下移；晚期拒绝成立。","reviewer":"Galileo-phase2","phase1_labels_modified":false,"post_signal_used_as_predictor":false},
  {"chart_number":2,"blind_chart_id":"B-008dc3eff6281883d3be","outcome_bucket":"SEVERE_LOSS","post_path_label":"EARLY_REJECTION","evidence":"+1至+5持续下移，至+10仍未有效收复；早期拒绝成立。","reviewer":"Galileo-phase2","phase1_labels_modified":false,"post_signal_used_as_predictor":false},
  {"chart_number":3,"blind_chart_id":"B-00f0eb5238e30f2b220f","outcome_bucket":"PROFIT_GE_4PCT","post_path_label":"IMMEDIATE_ACCEPTANCE","evidence":"+1至+5已出现持续抬升，H20前未见决定性回落；早段接受成立。","reviewer":"Galileo-phase2","phase1_labels_modified":false,"post_signal_used_as_predictor":false},
  {"chart_number":4,"blind_chart_id":"B-011d1df7cf996123a4a5","outcome_bucket":"PROFIT_GE_4PCT","post_path_label":"DELAYED_ACCEPTANCE","evidence":"+1至+5未确认方向，+6至+20转为持续抬升；属于延迟接受。","reviewer":"Galileo-phase2","phase1_labels_modified":false,"post_signal_used_as_predictor":false},
  {"chart_number":5,"blind_chart_id":"B-017ba5c044bc52e77579","outcome_bucket":"PROFIT_GE_4PCT","post_path_label":"IMMEDIATE_ACCEPTANCE","evidence":"+1至+5已出现持续抬升，H20前未见决定性回落；早段接受成立。","reviewer":"Galileo-phase2","phase1_labels_modified":false,"post_signal_used_as_predictor":false},
  {"chart_number":6,"blind_chart_id":"B-019aa9d7fcf4d5d9bb0e","outcome_bucket":"LOSS_0_TO_10PCT","post_path_label":"LATE_REJECTION","evidence":"前5日尚未持续走弱，+5后至H20形成明确下移；晚期拒绝成立。","reviewer":"Galileo-phase2","phase1_labels_modified":false,"post_signal_used_as_predictor":false},
  {"chart_number":7,"blind_chart_id":"B-01ce61bcf1ad077185ce","outcome_bucket":"LOSS_0_TO_10PCT","post_path_label":"CHOP_OR_AMBIGUOUS","evidence":"+1至+20反复上下、无持续单向段；接受与拒绝均不够清晰。","reviewer":"Galileo-phase2","phase1_labels_modified":false,"post_signal_used_as_predictor":false},
  {"chart_number":8,"blind_chart_id":"B-01e3f96cbc26f38c0c66","outcome_bucket":"PROFIT_GE_4PCT","post_path_label":"IMMEDIATE_ACCEPTANCE","evidence":"+1至+5已出现持续抬升，H20前未见决定性回落；早段接受成立。","reviewer":"Galileo-phase2","phase1_labels_modified":false,"post_signal_used_as_predictor":false},
  {"chart_number":9,"blind_chart_id":"B-01e9205869b6293494cb","outcome_bucket":"PROFIT_0_TO_4PCT","post_path_label":"DELAYED_ACCEPTANCE","evidence":"+1至+5未确认方向，+6至+20转为持续抬升；属于延迟接受。","reviewer":"Galileo-phase2","phase1_labels_modified":false,"post_signal_used_as_predictor":false},
  {"chart_number":10,"blind_chart_id":"B-01ef1f5feebe70738377","outcome_bucket":"PROFIT_GE_4PCT","post_path_label":"IMMEDIATE_ACCEPTANCE","evidence":"+1至+5已出现持续抬升，H20前未见决定性回落；早段接受成立。","reviewer":"Galileo-phase2","phase1_labels_modified":false,"post_signal_used_as_predictor":false},
  {"chart_number":11,"blind_chart_id":"B-0208d52f782a389ac1ee","outcome_bucket":"LOSS_0_TO_10PCT","post_path_label":"EARLY_REJECTION","evidence":"+1至+5持续下移，至+10仍未有效收复；早期拒绝成立。","reviewer":"Galileo-phase2","phase1_labels_modified":false,"post_signal_used_as_predictor":false},
  {"chart_number":12,"blind_chart_id":"B-0235bcd8fd38ddae9503","outcome_bucket":"PROFIT_GE_4PCT","post_path_label":"IMMEDIATE_ACCEPTANCE","evidence":"+1至+5已出现持续抬升，H20前未见决定性回落；早段接受成立。","reviewer":"Galileo-phase2","phase1_labels_modified":false,"post_signal_used_as_predictor":false},
  {"chart_number":13,"blind_chart_id":"B-023c78ab5339bda30688","outcome_bucket":"PROFIT_GE_4PCT","post_path_label":"DELAYED_ACCEPTANCE","evidence":"+1至+5未确认方向，+6至+20转为持续抬升；属于延迟接受。","reviewer":"Galileo-phase2","phase1_labels_modified":false,"post_signal_used_as_predictor":false},
  {"chart_number":14,"blind_chart_id":"B-0243444df23102ab898b","outcome_bucket":"PROFIT_0_TO_4PCT","post_path_label":"CHOP_OR_AMBIGUOUS","evidence":"+1至+20反复上下、无持续单向段；接受与拒绝均不够清晰。","reviewer":"Galileo-phase2","phase1_labels_modified":false,"post_signal_used_as_predictor":false},
  {"chart_number":15,"blind_chart_id":"B-025ff6cb8a4e3eca4eff","outcome_bucket":"PROFIT_GE_4PCT","post_path_label":"IMMEDIATE_ACCEPTANCE","evidence":"+1至+5已出现持续抬升，H20前未见决定性回落；早段接受成立。","reviewer":"Galileo-phase2","phase1_labels_modified":false,"post_signal_used_as_predictor":false},
  {"chart_number":16,"blind_chart_id":"B-026fb55f78d33dad1593","outcome_bucket":"PROFIT_GE_4PCT","post_path_label":"IMMEDIATE_ACCEPTANCE","evidence":"+1至+5已出现持续抬升，H20前未见决定性回落；早段接受成立。","reviewer":"Galileo-phase2","phase1_labels_modified":false,"post_signal_used_as_predictor":false},
  {"chart_number":17,"blind_chart_id":"B-027486d53f0aa4e6e946","outcome_bucket":"PROFIT_GE_4PCT","post_path_label":"IMMEDIATE_ACCEPTANCE","evidence":"+1至+5已出现持续抬升，H20前未见决定性回落；早段接受成立。","reviewer":"Galileo-phase2","phase1_labels_modified":false,"post_signal_used_as_predictor":false},
  {"chart_number":18,"blind_chart_id":"B-02dc8a10828b7f4b750b","outcome_bucket":"PROFIT_GE_4PCT","post_path_label":"IMMEDIATE_ACCEPTANCE","evidence":"+1至+5已出现持续抬升，H20前未见决定性回落；早段接受成立。","reviewer":"Galileo-phase2","phase1_labels_modified":false,"post_signal_used_as_predictor":false},
  {"chart_number":19,"blind_chart_id":"B-02eed9cfe3b96c9e52fe","outcome_bucket":"PROFIT_GE_4PCT","post_path_label":"IMMEDIATE_ACCEPTANCE","evidence":"+1至+5已出现持续抬升，H20前未见决定性回落；早段接受成立。","reviewer":"Galileo-phase2","phase1_labels_modified":false,"post_signal_used_as_predictor":false},
  {"chart_number":20,"blind_chart_id":"B-0312b7903220118f0044","outcome_bucket":"PROFIT_GE_4PCT","post_path_label":"IMMEDIATE_ACCEPTANCE","evidence":"+1至+5已出现持续抬升，H20前未见决定性回落；早段接受成立。","reviewer":"Galileo-phase2","phase1_labels_modified":false,"post_signal_used_as_predictor":false},
  {"chart_number":21,"blind_chart_id":"B-03364b8cc7b3cd5e88b0","outcome_bucket":"PROFIT_GE_4PCT","post_path_label":"IMMEDIATE_ACCEPTANCE","evidence":"+1至+5已出现持续抬升，H20前未见决定性回落；早段接受成立。","reviewer":"Galileo-phase2","phase1_labels_modified":false,"post_signal_used_as_predictor":false},
  {"chart_number":22,"blind_chart_id":"B-036d5d90ba458dce2a87","outcome_bucket":"PROFIT_GE_4PCT","post_path_label":"IMMEDIATE_ACCEPTANCE","evidence":"+1至+5已出现持续抬升，H20前未见决定性回落；早段接受成立。","reviewer":"Galileo-phase2","phase1_labels_modified":false,"post_signal_used_as_predictor":false},
  {"chart_number":23,"blind_chart_id":"B-037618301ff936fa512b","outcome_bucket":"LOSS_0_TO_10PCT","post_path_label":"LATE_REJECTION","evidence":"前5日尚未持续走弱，+5后至H20形成明确下移；晚期拒绝成立。","reviewer":"Galileo-phase2","phase1_labels_modified":false,"post_signal_used_as_predictor":false},
  {"chart_number":24,"blind_chart_id":"B-0379b9547e5017f7a162","outcome_bucket":"LOSS_0_TO_10PCT","post_path_label":"EARLY_REJECTION","evidence":"+1至+5持续下移，至+10仍未有效收复；早期拒绝成立。","reviewer":"Galileo-phase2","phase1_labels_modified":false,"post_signal_used_as_predictor":false},
  {"chart_number":25,"blind_chart_id":"B-03bc9b29b59e3adb39dc","outcome_bucket":"LOSS_0_TO_10PCT","post_path_label":"EARLY_REJECTION","evidence":"+1至+5持续下移，至+10仍未有效收复；早期拒绝成立。","reviewer":"Galileo-phase2","phase1_labels_modified":false,"post_signal_used_as_predictor":false},
  {"chart_number":26,"blind_chart_id":"B-03c00457e208d9d387b8","outcome_bucket":"PROFIT_GE_4PCT","post_path_label":"IMMEDIATE_ACCEPTANCE","evidence":"+1至+5已出现持续抬升，H20前未见决定性回落；早段接受成立。","reviewer":"Galileo-phase2","phase1_labels_modified":false,"post_signal_used_as_predictor":false},
  {"chart_number":27,"blind_chart_id":"B-03df2145f58b04542ab7","outcome_bucket":"PROFIT_GE_4PCT","post_path_label":"IMMEDIATE_ACCEPTANCE","evidence":"+1至+5已出现持续抬升，H20前未见决定性回落；早段接受成立。","reviewer":"Galileo-phase2","phase1_labels_modified":false,"post_signal_used_as_predictor":false},
  {"chart_number":28,"blind_chart_id":"B-03f5dc3eed3a8dc8c2d1","outcome_bucket":"PROFIT_GE_4PCT","post_path_label":"IMMEDIATE_ACCEPTANCE","evidence":"+1至+5已出现持续抬升，H20前未见决定性回落；早段接受成立。","reviewer":"Galileo-phase2","phase1_labels_modified":false,"post_signal_used_as_predictor":false},
  {"chart_number":29,"blind_chart_id":"B-040b9493e620037f4723","outcome_bucket":"PROFIT_GE_4PCT","post_path_label":"IMMEDIATE_ACCEPTANCE","evidence":"+1至+5已出现持续抬升，H20前未见决定性回落；早段接受成立。","reviewer":"Galileo-phase2","phase1_labels_modified":false,"post_signal_used_as_predictor":false},
  {"chart_number":30,"blind_chart_id":"B-046c5433e7b8ea864c26","outcome_bucket":"SEVERE_LOSS","post_path_label":"EARLY_REJECTION","evidence":"+1至+5持续下移，至+10仍未有效收复；早期拒绝成立。","reviewer":"Galileo-phase2","phase1_labels_modified":false,"post_signal_used_as_predictor":false},
  {"chart_number":31,"blind_chart_id":"B-049cbe94df67f8e07a2d","outcome_bucket":"LOSS_0_TO_10PCT","post_path_label":"CHOP_OR_AMBIGUOUS","evidence":"+1至+20反复上下、无持续单向段；接受与拒绝均不够清晰。","reviewer":"Galileo-phase2","phase1_labels_modified":false,"post_signal_used_as_predictor":false},
  {"chart_number":32,"blind_chart_id":"B-049f28367fb0284f4742","outcome_bucket":"SEVERE_LOSS","post_path_label":"EARLY_REJECTION","evidence":"+1至+5持续下移，至+10仍未有效收复；早期拒绝成立。","reviewer":"Galileo-phase2","phase1_labels_modified":false,"post_signal_used_as_predictor":false},
  {"chart_number":33,"blind_chart_id":"B-04b74d50c83537240a10","outcome_bucket":"SEVERE_LOSS","post_path_label":"EARLY_REJECTION","evidence":"+1至+5持续下移，至+10仍未有效收复；早期拒绝成立。","reviewer":"Galileo-phase2","phase1_labels_modified":false,"post_signal_used_as_predictor":false},
  {"chart_number":34,"blind_chart_id":"B-04eb18d7d3175724f19b","outcome_bucket":"LOSS_0_TO_10PCT","post_path_label":"EARLY_REJECTION","evidence":"+1至+5持续下移，至+10仍未有效收复；早期拒绝成立。","reviewer":"Galileo-phase2","phase1_labels_modified":false,"post_signal_used_as_predictor":false},
  {"chart_number":35,"blind_chart_id":"B-04fe8f80234938fc3327","outcome_bucket":"LOSS_0_TO_10PCT","post_path_label":"LATE_REJECTION","evidence":"前5日尚未持续走弱，+5后至H20形成明确下移；晚期拒绝成立。","reviewer":"Galileo-phase2","phase1_labels_modified":false,"post_signal_used_as_predictor":false},